{
  "id": "a1b2c3d4-e5f6-7890-abcd-ef1234567890",
  "account_id": "a1b2c3d4-e5f6-7890-abcd-ef1234567890",
  "portfolio_id": "a1b2c3d4-e5f6-7890-abcd-ef1234567890",
  "instrument_id": "a1b2c3d4-e5f6-7890-abcd-ef1234567890",
  "cash_amount": "example-string",
  "currency": "EUR",
  "frequency": "WEEKLY",
  "status": "ACTIVE",
  "next_execution_date": "1990-01-15",
  "created_at": "2025-03-15T14:30:00Z",
  "updated_at": "2025-03-15T14:30:00Z"
}